-- Automatically generated by SQLQueryTestSuite
-- !query
CREATE OR REPLACE TEMP VIEW trades(trade_time, symbol, quantity) AS
  VALUES (TIMESTAMP '2026-06-29 10:00:05', 'AAPL', 100),
         (TIMESTAMP '2026-06-29 10:00:11', 'AAPL', 200),
         (TIMESTAMP '2026-06-29 10:00:12', 'MSFT',  50),
         (TIMESTAMP '2026-06-29 09:59:59', 'GOOG',  30)
-- !query schema
struct<>
-- !query output



-- !query
CREATE OR REPLACE TEMP VIEW quotes(quote_time, symbol, bid_price) AS
  VALUES (TIMESTAMP '2026-06-29 10:00:00', 'AAPL', 180.10),
         (TIMESTAMP '2026-06-29 10:00:07', 'AAPL', 180.15),
         (TIMESTAMP '2026-06-29 10:00:10', 'AAPL', 180.20),
         (TIMESTAMP '2026-06-29 10:00:08', 'MSFT', 420.50)
-- !query schema
struct<>
-- !query output



-- !query
CREATE OR REPLACE TEMP VIEW asof_matched_v AS
SELECT t.trade_time, q.bid_price
FROM trades t ASOF JOIN quotes q
  MATCH_CONDITION (t.trade_time >= q.quote_time)
  ON t.symbol = q.symbol
-- !query schema
struct<>
-- !query output



-- !query
SELECT count(*) AS cnt FROM asof_matched_v
-- !query schema
struct<cnt:bigint>
-- !query output
3


-- !query
CREATE OR REPLACE VIEW asof_perm_v AS
SELECT t.trade_time, q.bid_price
FROM trades t ASOF JOIN quotes q
  MATCH_CONDITION (t.trade_time >= q.quote_time)
  ON t.symbol = q.symbol
-- !query schema
struct<>
-- !query output
org.apache.spark.sql.AnalysisException
{
  "errorClass" : "INVALID_TEMP_OBJ_REFERENCE",
  "sqlState" : "42K0F",
  "messageParameters" : {
    "obj" : "VIEW",
    "objName" : "`spark_catalog`.`default`.`asof_perm_v`",
    "tempObj" : "VIEW",
    "tempObjName" : "`trades`"
  }
}


-- !query
SELECT count(*) AS cnt FROM asof_perm_v
-- !query schema
struct<>
-- !query output
org.apache.spark.sql.catalyst.ExtendedAnalysisException
{
  "errorClass" : "TABLE_OR_VIEW_NOT_FOUND",
  "sqlState" : "42P01",
  "messageParameters" : {
    "relationName" : "`asof_perm_v`",
    "searchPath" : "[`system`.`builtin`, `system`.`session`, `spark_catalog`.`default`]"
  },
  "queryContext" : [ {
    "objectType" : "",
    "objectName" : "",
    "startIndex" : 29,
    "stopIndex" : 39,
    "fragment" : "asof_perm_v"
  } ]
}


-- !query
WITH matched AS (
  SELECT t.trade_time, t.symbol, q.bid_price
  FROM trades t ASOF JOIN quotes q
    MATCH_CONDITION (t.trade_time >= q.quote_time)
    ON t.symbol = q.symbol
)
SELECT count(*) AS cnt FROM matched
-- !query schema
struct<cnt:bigint>
-- !query output
3


-- !query
WITH RECURSIVE chain AS (
  SELECT trade_time AS ts, symbol, 1 AS depth
  FROM trades
  WHERE symbol = 'AAPL' AND trade_time = TIMESTAMP '2026-06-29 10:00:05'
  UNION ALL
  SELECT q.quote_time, c.symbol, c.depth + 1
  FROM chain c ASOF JOIN quotes q
    MATCH_CONDITION (c.ts >= q.quote_time)
    ON c.symbol = q.symbol
  WHERE c.depth < 2
)
SELECT count(*) AS cnt FROM chain
-- !query schema
struct<cnt:bigint>
-- !query output
2


-- !query
CREATE OR REPLACE FUNCTION asof_match_count() RETURNS INT RETURN (
  SELECT count(*)
  FROM trades t ASOF JOIN quotes q
    MATCH_CONDITION (t.trade_time >= q.quote_time)
    ON t.symbol = q.symbol
)
-- !query schema
struct<>
-- !query output
org.apache.spark.sql.AnalysisException
{
  "errorClass" : "INVALID_TEMP_OBJ_REFERENCE",
  "sqlState" : "42K0F",
  "messageParameters" : {
    "obj" : "FUNCTION",
    "objName" : "`default`.`asof_match_count`",
    "tempObj" : "VIEW",
    "tempObjName" : "`trades`"
  }
}


-- !query
SELECT asof_match_count() AS cnt
-- !query schema
struct<>
-- !query output
org.apache.spark.sql.AnalysisException
{
  "errorClass" : "UNRESOLVED_ROUTINE",
  "sqlState" : "42883",
  "messageParameters" : {
    "routineName" : "`asof_match_count`",
    "searchPath" : "[`system`.`builtin`, `system`.`session`, `spark_catalog`.`default`]"
  },
  "queryContext" : [ {
    "objectType" : "",
    "objectName" : "",
    "startIndex" : 8,
    "stopIndex" : 25,
    "fragment" : "asof_match_count()"
  } ]
}


-- !query
CREATE OR REPLACE FUNCTION asof_matches()
RETURNS TABLE (trade_time TIMESTAMP, bid_price DOUBLE)
RETURN
  SELECT t.trade_time, q.bid_price
  FROM trades t ASOF JOIN quotes q
    MATCH_CONDITION (t.trade_time >= q.quote_time)
    ON t.symbol = q.symbol
-- !query schema
struct<>
-- !query output
org.apache.spark.sql.AnalysisException
{
  "errorClass" : "INVALID_TEMP_OBJ_REFERENCE",
  "sqlState" : "42K0F",
  "messageParameters" : {
    "obj" : "FUNCTION",
    "objName" : "`default`.`asof_matches`",
    "tempObj" : "VIEW",
    "tempObjName" : "`trades`"
  }
}


-- !query
SELECT count(*) AS cnt FROM asof_matches()
-- !query schema
struct<>
-- !query output
org.apache.spark.sql.AnalysisException
{
  "errorClass" : "UNRESOLVABLE_TABLE_VALUED_FUNCTION",
  "sqlState" : "42883",
  "messageParameters" : {
    "name" : "`asof_matches`"
  },
  "queryContext" : [ {
    "objectType" : "",
    "objectName" : "",
    "startIndex" : 29,
    "stopIndex" : 42,
    "fragment" : "asof_matches()"
  } ]
}


-- !query
DROP TABLE IF EXISTS asof_ctas_tgt
-- !query schema
struct<>
-- !query output



-- !query
CREATE TABLE asof_ctas_tgt USING parquet AS
SELECT t.trade_time, t.symbol, q.bid_price
FROM trades t ASOF JOIN quotes q
  MATCH_CONDITION (t.trade_time >= q.quote_time)
  ON t.symbol = q.symbol
-- !query schema
struct<>
-- !query output



-- !query
SELECT count(*) AS cnt FROM asof_ctas_tgt
-- !query schema
struct<cnt:bigint>
-- !query output
3


-- !query
DROP TABLE IF EXISTS asof_insert_tgt
-- !query schema
struct<>
-- !query output



-- !query
CREATE TABLE asof_insert_tgt (trade_time TIMESTAMP, symbol STRING, bid_price DOUBLE) USING parquet
-- !query schema
struct<>
-- !query output



-- !query
INSERT INTO asof_insert_tgt
SELECT t.trade_time, t.symbol, q.bid_price
FROM trades t ASOF JOIN quotes q
  MATCH_CONDITION (t.trade_time >= q.quote_time)
  ON t.symbol = q.symbol
-- !query schema
struct<>
-- !query output



-- !query
SELECT count(*) AS cnt FROM asof_insert_tgt
-- !query schema
struct<cnt:bigint>
-- !query output
3


-- !query
DROP TABLE IF EXISTS asof_merge_tgt
-- !query schema
struct<>
-- !query output



-- !query
CREATE TABLE asof_merge_tgt (symbol STRING, trade_time TIMESTAMP, bid_price DOUBLE) USING parquet
-- !query schema
struct<>
-- !query output



-- !query
MERGE INTO asof_merge_tgt AS tgt
USING (
  SELECT t.symbol, t.trade_time, q.bid_price
  FROM trades t ASOF JOIN quotes q
    MATCH_CONDITION (t.trade_time >= q.quote_time)
    ON t.symbol = q.symbol
) AS src
ON tgt.symbol = src.symbol AND tgt.trade_time = src.trade_time
WHEN MATCHED THEN UPDATE SET tgt.bid_price = src.bid_price
WHEN NOT MATCHED THEN INSERT *
-- !query schema
struct<>
-- !query output
org.apache.spark.SparkUnsupportedOperationException
{
  "errorClass" : "UNSUPPORTED_FEATURE.TABLE_OPERATION",
  "sqlState" : "0A000",
  "messageParameters" : {
    "operation" : "MERGE INTO TABLE",
    "tableName" : "`spark_catalog`.`default`.`asof_merge_tgt`"
  }
}


-- !query
SELECT count(*) AS cnt FROM asof_merge_tgt
-- !query schema
struct<cnt:bigint>
-- !query output
0


-- !query
DROP TABLE IF EXISTS asof_update_tgt
-- !query schema
struct<>
-- !query output



-- !query
CREATE TABLE asof_update_tgt (symbol STRING, trade_time TIMESTAMP, bid_price DOUBLE) USING parquet
-- !query schema
struct<>
-- !query output



-- !query
INSERT INTO asof_update_tgt VALUES
  ('AAPL', TIMESTAMP '2026-06-29 10:00:05', 0.0),
  ('AAPL', TIMESTAMP '2026-06-29 10:00:11', 0.0)
-- !query schema
struct<>
-- !query output



-- !query
UPDATE asof_update_tgt AS tgt
SET bid_price = (
  SELECT q.bid_price
  FROM trades t ASOF JOIN quotes q
    MATCH_CONDITION (t.trade_time >= q.quote_time)
    ON t.symbol = q.symbol
  WHERE t.trade_time = tgt.trade_time AND t.symbol = tgt.symbol
)
-- !query schema
struct<>
-- !query output
org.apache.spark.SparkUnsupportedOperationException
{
  "errorClass" : "UNSUPPORTED_FEATURE.TABLE_OPERATION",
  "sqlState" : "0A000",
  "messageParameters" : {
    "operation" : "UPDATE TABLE",
    "tableName" : "`spark_catalog`.`default`.`asof_update_tgt`"
  }
}


-- !query
SELECT symbol, trade_time, bid_price
FROM asof_update_tgt
ORDER BY trade_time
-- !query schema
struct<symbol:string,trade_time:timestamp,bid_price:double>
-- !query output
AAPL	2026-06-29 10:00:05	0.0
AAPL	2026-06-29 10:00:11	0.0


-- !query
UPDATE asof_update_tgt
SET bid_price = -1.0
WHERE trade_time IN (
  SELECT t.trade_time
  FROM trades t ASOF JOIN quotes q
    MATCH_CONDITION (t.trade_time >= q.quote_time)
    ON t.symbol = q.symbol
  WHERE q.bid_price > 200
)
-- !query schema
struct<>
-- !query output
org.apache.spark.SparkUnsupportedOperationException
{
  "errorClass" : "UNSUPPORTED_FEATURE.TABLE_OPERATION",
  "sqlState" : "0A000",
  "messageParameters" : {
    "operation" : "UPDATE TABLE",
    "tableName" : "`spark_catalog`.`default`.`asof_update_tgt`"
  }
}


-- !query
SELECT count(*) AS flagged_cnt FROM asof_update_tgt WHERE bid_price = -1.0
-- !query schema
struct<flagged_cnt:bigint>
-- !query output
0


-- !query
DELETE FROM asof_update_tgt
WHERE symbol IN (
  SELECT t.symbol
  FROM trades t ASOF JOIN quotes q
    MATCH_CONDITION (t.trade_time >= q.quote_time)
    ON t.symbol = q.symbol
  WHERE t.symbol = 'GOOG'
)
-- !query schema
struct<>
-- !query output
org.apache.spark.sql.AnalysisException
{
  "errorClass" : "UNSUPPORTED_FEATURE.TABLE_OPERATION",
  "sqlState" : "0A000",
  "messageParameters" : {
    "operation" : "DELETE",
    "tableName" : "`spark_catalog`.`default`.`asof_update_tgt`"
  }
}


-- !query
SELECT count(*) AS remaining_cnt FROM asof_update_tgt
-- !query schema
struct<remaining_cnt:bigint>
-- !query output
2


-- !query
BEGIN
  DECLARE fetched_time TIMESTAMP;
  DECLARE fetched_bid DOUBLE;
  DECLARE cur CURSOR FOR
    SELECT t.trade_time, q.bid_price
    FROM trades t ASOF JOIN quotes q
      MATCH_CONDITION (t.trade_time >= q.quote_time)
      ON t.symbol = q.symbol
    ORDER BY t.trade_time;
  OPEN cur;
  FETCH cur INTO fetched_time, fetched_bid;
  CLOSE cur;
  SELECT fetched_time, fetched_bid;
END
-- !query schema
struct<fetched_time:timestamp,fetched_bid:double>
-- !query output
2026-06-29 10:00:05	180.1
