-- Automatically generated by SQLQueryTestSuite
-- !query
SELECT parse_sql(NULL)
-- !query schema
struct<parse_sql(NULL):string>
-- !query output
NULL


-- !query
SELECT parse_sql('SELECT a, b FROM t')
-- !query schema
struct<parse_sql(SELECT a, b FROM t):string>
-- !query output
{"parse_success":true,"statement_identifier":"SELECT","statement_code":21,"source_table_references":[["t"]],"select_list":[{"name":["a"]},{"name":["b"]}]}


-- !query
SELECT parse_sql('SELECT db.my_func(a), count(b) FROM cat.ns.t1 JOIN t2')
-- !query schema
struct<parse_sql(SELECT db.my_func(a), count(b) FROM cat.ns.t1 JOIN t2):string>
-- !query output
{"parse_success":true,"statement_identifier":"SELECT","statement_code":21,"source_table_references":[["cat","ns","t1"],["t2"]],"function_references":[["db","my_func"],["count"]],"select_list":[{"name":[]},{"name":[]}]}


-- !query
SELECT
  get_json_object(result, '$.statement_identifier') AS statement_identifier,
  get_json_object(result, '$.source_table_references[0][0]') AS first_table,
  get_json_object(result, '$.select_list[1].name[0]') AS second_column
FROM (SELECT parse_sql('SELECT a, b FROM t') AS result)
-- !query schema
struct<statement_identifier:string,first_table:string,second_column:string>
-- !query output
SELECT	t	b


-- !query
SELECT parse_sql('INSERT INTO t SELECT 1')
-- !query schema
struct<parse_sql(INSERT INTO t SELECT 1):string>
-- !query output
{"parse_success":true,"statement_identifier":"INSERT","statement_code":50,"target_table_references":[["t"]],"select_list":[{"name":[]}]}


-- !query
SELECT parse_sql('DELETE FROM t WHERE a = 1')
-- !query schema
struct<parse_sql(DELETE FROM t WHERE a = 1):string>
-- !query output
{"parse_success":true,"statement_identifier":"DELETE WHERE","statement_code":19,"target_table_references":[["t"]]}


-- !query
SELECT parse_sql('UPDATE t SET a = 1 WHERE b = 2')
-- !query schema
struct<parse_sql(UPDATE t SET a = 1 WHERE b = 2):string>
-- !query output
{"parse_success":true,"statement_identifier":"UPDATE WHERE","statement_code":82,"target_table_references":[["t"]]}


-- !query
SELECT parse_sql('MERGE INTO t USING s ON t.id = s.id WHEN MATCHED THEN DELETE')
-- !query schema
struct<parse_sql(MERGE INTO t USING s ON t.id = s.id WHEN MATCHED THEN DELETE):string>
-- !query output
{"parse_success":true,"statement_identifier":"MERGE","statement_code":128,"target_table_references":[["t"]],"source_table_references":[["s"]]}


-- !query
SELECT parse_sql('CREATE TABLE t (a INT)')
-- !query schema
struct<parse_sql(CREATE TABLE t (a INT)):string>
-- !query output
{"parse_success":true,"statement_identifier":"CREATE TABLE","statement_code":77,"target_table_references":[["t"]]}


-- !query
SELECT parse_sql('CREATE TABLE t AS SELECT 1 AS a')
-- !query schema
struct<parse_sql(CREATE TABLE t AS SELECT 1 AS a):string>
-- !query output
{"parse_success":true,"statement_identifier":"CREATE TABLE","statement_code":77,"target_table_references":[["t"]],"select_list":[{"name":["a"]}]}


-- !query
SELECT parse_sql('DROP TABLE t')
-- !query schema
struct<parse_sql(DROP TABLE t):string>
-- !query output
{"parse_success":true,"statement_identifier":"DROP TABLE","statement_code":32,"target_table_references":[["t"]]}


-- !query
SELECT parse_sql('CACHE TABLE t')
-- !query schema
struct<parse_sql(CACHE TABLE t):string>
-- !query output
{"parse_success":true,"statement_identifier":"CACHE TABLE","statement_code":-1,"target_table_references":[["t"]]}


-- !query
SELECT parse_sql('TABLE t')
-- !query schema
struct<parse_sql(TABLE t):string>
-- !query output
{"parse_success":true,"statement_identifier":"SELECT","statement_code":21,"source_table_references":[["t"]]}


-- !query
SELECT parse_sql('VALUES (1), (2)')
-- !query schema
struct<parse_sql(VALUES (1), (2)):string>
-- !query output
{"parse_success":true,"statement_identifier":"SELECT","statement_code":21}


-- !query
SELECT parse_sql('CREATE FUNCTION f AS ''x'' USING JAR ''y.jar''')
-- !query schema
struct<parse_sql(CREATE FUNCTION f AS 'x' USING JAR 'y.jar'):string>
-- !query output
{"parse_success":true,"statement_identifier":"CREATE ROUTINE","statement_code":14}


-- !query
SELECT parse_sql('DECLARE VARIABLE x INT')
-- !query schema
struct<parse_sql(DECLARE VARIABLE x INT):string>
-- !query output
{"parse_success":true,"statement_identifier":"DECLARE VARIABLE","statement_code":-8}


-- !query
SELECT parse_sql('SELECT * FROM t WHERE a = :foo AND b = ?')
-- !query schema
struct<parse_sql(SELECT * FROM t WHERE a = :foo AND b = ?):string>
-- !query output
{"parse_success":true,"statement_identifier":"SELECT","statement_code":21,"source_table_references":[["t"]],"select_list":[{"name":["*"]}],"parameter_markers":{"named":["foo"],"unnamed_count":1}}


-- !query
SELECT parse_sql('WITH cte AS (SELECT a FROM hidden_base) SELECT a FROM cte')
-- !query schema
struct<parse_sql(WITH cte AS (SELECT a FROM hidden_base) SELECT a FROM cte):string>
-- !query output
{"parse_success":true,"statement_identifier":"SELECT","statement_code":21,"source_table_references":[["hidden_base"]],"select_list":[{"name":["a"]}]}


-- !query
SELECT parse_sql('SELECT * FROM real_t WHERE EXISTS (WITH real_t AS (SELECT * FROM inner_base) SELECT * FROM real_t)')
-- !query schema
struct<parse_sql(SELECT * FROM real_t WHERE EXISTS (WITH real_t AS (SELECT * FROM inner_base) SELECT * FROM real_t)):string>
-- !query output
{"parse_success":true,"statement_identifier":"SELECT","statement_code":21,"source_table_references":[["inner_base"],["real_t"]],"select_list":[{"name":["*"]}]}


-- !query
SELECT parse_sql('WITH a AS (SELECT * FROM b), b AS (SELECT 1 AS x) SELECT * FROM a')
-- !query schema
struct<parse_sql(WITH a AS (SELECT * FROM b), b AS (SELECT 1 AS x) SELECT * FROM a):string>
-- !query output
{"parse_success":true,"statement_identifier":"SELECT","statement_code":21,"source_table_references":[["b"]],"select_list":[{"name":["*"]}]}


-- !query
SELECT parse_sql('SELECT (SELECT max(v) FROM scalar_src) AS m, t.a FROM outer_t t WHERE EXISTS (SELECT 1 FROM exists_src e WHERE e.id = t.id)')
-- !query schema
struct<parse_sql(SELECT (SELECT max(v) FROM scalar_src) AS m, t.a FROM outer_t t WHERE EXISTS (SELECT 1 FROM exists_src e WHERE e.id = t.id)):string>
-- !query output
{"parse_success":true,"statement_identifier":"SELECT","statement_code":21,"source_table_references":[["scalar_src"],["exists_src"],["outer_t"]],"function_references":[["max"]],"select_list":[{"name":["m"]},{"name":["t","a"]}]}


-- !query
SELECT parse_sql(
'SELECT coalesce(t.a, 0), sum(abs(t.b)) OVER (
   PARTITION BY lower(t.c) ORDER BY length(t.d))
 FROM left_t t
 JOIN right_t r ON hash(t.id) = hash(r.id)
 JOIN LATERAL range(cast(t.n AS BIGINT)) rng
 WHERE startswith(t.c, ''x'')
   AND EXISTS (SELECT max(s.v) FROM scalar_t s WHERE s.id = t.id)
 GROUP BY coalesce(t.a, 0), t.b, t.c, t.d
 HAVING count_if(t.b > 0) > 0
 ORDER BY greatest(t.a, 1)')
-- !query schema
struct<parse_sql(SELECT coalesce(t.a, 0), sum(abs(t.b)) OVER (
   PARTITION BY lower(t.c) ORDER BY length(t.d))
 FROM left_t t
 JOIN right_t r ON hash(t.id) = hash(r.id)
 JOIN LATERAL range(cast(t.n AS BIGINT)) rng
 WHERE startswith(t.c, 'x')
   AND EXISTS (SELECT max(s.v) FROM scalar_t s WHERE s.id = t.id)
 GROUP BY coalesce(t.a, 0), t.b, t.c, t.d
 HAVING count_if(t.b > 0) > 0
 ORDER BY greatest(t.a, 1)):string>
-- !query output
{"parse_success":true,"statement_identifier":"SELECT","statement_code":21,"source_table_references":[["scalar_t"],["left_t"],["right_t"]],"function_references":[["greatest"],["count_if"],["coalesce"],["sum"],["abs"],["lower"],["length"],["startswith"],["max"],["range"],["hash"]],"select_list":[{"name":[]},{"name":[]}]}


-- !query
SELECT parse_sql(
'MERGE INTO target t
 USING (
   SELECT id, normalize_name(name) AS name
   FROM source
   WHERE is_valid(id)
 ) s
 ON hash(t.id) = hash(s.id)
 WHEN MATCHED AND should_update(t.name, s.name) THEN
   UPDATE SET name = coalesce(s.name, upper(t.name))
 WHEN NOT MATCHED THEN
   INSERT (id, name) VALUES (s.id, lower(s.name))')
-- !query schema
struct<parse_sql(MERGE INTO target t
 USING (
   SELECT id, normalize_name(name) AS name
   FROM source
   WHERE is_valid(id)
 ) s
 ON hash(t.id) = hash(s.id)
 WHEN MATCHED AND should_update(t.name, s.name) THEN
   UPDATE SET name = coalesce(s.name, upper(t.name))
 WHEN NOT MATCHED THEN
   INSERT (id, name) VALUES (s.id, lower(s.name))):string>
-- !query output
{"parse_success":true,"statement_identifier":"MERGE","statement_code":128,"target_table_references":[["target"]],"source_table_references":[["source"]],"function_references":[["hash"],["should_update"],["coalesce"],["upper"],["lower"],["normalize_name"],["is_valid"]]}


-- !query
SELECT parse_sql(
'CREATE TABLE defaults (
   created DATE DEFAULT current_date(),
   normalized STRING DEFAULT upper(''x'')
 )')
-- !query schema
struct<parse_sql(CREATE TABLE defaults (
   created DATE DEFAULT current_date(),
   normalized STRING DEFAULT upper('x')
 )):string>
-- !query output
{"parse_success":true,"statement_identifier":"CREATE TABLE","statement_code":77,"target_table_references":[["defaults"]],"function_references":[["current_date"],["upper"]]}


-- !query
SELECT parse_sql('SELEC FROM t')
-- !query schema
struct<parse_sql(SELEC FROM t):string>
-- !query output
{"parse_success":false,"error":{"errorClass":"PARSE_SYNTAX_ERROR","messageTemplate":"Syntax error at or near <error><hint>.","sqlState":"42601","messageParameters":{"error":"'SELEC'","hint":""},"queryContext":[{"objectType":"","objectName":"","startIndex":1,"stopIndex":12,"fragment":"SELEC FROM t"}],"line":1,"position":0}}


-- !query
SELECT
  get_json_object(result, '$.parse_success') AS parse_success,
  get_json_object(result, '$.error.errorClass') AS error_class,
  get_json_object(result, '$.error.queryContext[0].fragment') AS fragment
FROM (SELECT parse_sql('SELEC FROM t') AS result)
-- !query schema
struct<parse_success:string,error_class:string,fragment:string>
-- !query output
false	PARSE_SYNTAX_ERROR	SELEC FROM t


-- !query
SELECT parse_sql(
'SELECT *
 FROM t
 ORDER BY a
 CLUSTER BY b')
-- !query schema
struct<parse_sql(SELECT *
 FROM t
 ORDER BY a
 CLUSTER BY b):string>
-- !query output
{"parse_success":false,"error":{"errorClass":"UNSUPPORTED_FEATURE.COMBINATION_QUERY_RESULT_CLAUSES","messageTemplate":"The feature is not supported: Combination of ORDER BY/SORT BY/DISTRIBUTE BY/CLUSTER BY.","sqlState":"0A000","queryContext":[{"objectType":"","objectName":"","startIndex":19,"stopIndex":42,"fragment":"ORDER BY a\n CLUSTER BY b"}],"line":3,"position":1}}


-- !query
SELECT
  get_json_object(result, '$.error.errorClass') AS error_class,
  get_json_object(result, '$.error.line') AS line,
  get_json_object(result, '$.error.position') AS position,
  get_json_object(result, '$.error.queryContext[0].startIndex') AS start_index
FROM (
  SELECT parse_sql(
'SELECT *
 FROM t
 ORDER BY a
 CLUSTER BY b') AS result
)
-- !query schema
struct<error_class:string,line:string,position:string,start_index:string>
-- !query output
UNSUPPORTED_FEATURE.COMBINATION_QUERY_RESULT_CLAUSES	3	1	19


-- !query
SELECT parse_sql('')
-- !query schema
struct<parse_sql():string>
-- !query output
{"parse_success":false,"error":{"errorClass":"PARSE_EMPTY_STATEMENT","messageTemplate":"Syntax error, unexpected empty statement.","sqlState":"42617","line":1,"position":0}}


-- !query
SELECT parse_sql('USE bad-name')
-- !query schema
struct<parse_sql(USE bad-name):string>
-- !query output
{"parse_success":false,"error":{"errorClass":"INVALID_IDENTIFIER","messageTemplate":"The unquoted identifier <ident> is invalid and must be back quoted as: `<ident>`.\nUnquoted identifiers can only contain ASCII letters ('a' - 'z', 'A' - 'Z'), digits ('0' - '9'), and underbar ('_').\nUnquoted identifiers must also not start with a digit.\nDifferent data sources and meta stores may impose additional restrictions on valid identifiers.","sqlState":"42602","messageParameters":{"ident":"bad-name"},"queryContext":[{"objectType":"","objectName":"","startIndex":1,"stopIndex":12,"fragment":"USE bad-name"}],"line":1,"position":7}}


-- !query
SELECT parse_sql('WITH c AS (SELECT 1), c AS (SELECT 2) SELECT * FROM c')
-- !query schema
struct<parse_sql(WITH c AS (SELECT 1), c AS (SELECT 2) SELECT * FROM c):string>
-- !query output
{"parse_success":false,"error":{"errorClass":"DUPLICATED_CTE_NAMES","messageTemplate":"CTE definition can't have duplicate names: <duplicateNames>.","sqlState":"42602","messageParameters":{"duplicateNames":"`c`"},"queryContext":[{"objectType":"","objectName":"","startIndex":1,"stopIndex":53,"fragment":"WITH c AS (SELECT 1), c AS (SELECT 2) SELECT * FROM c"}],"line":1,"position":0}}


-- !query
SELECT parse_sql('MERGE INTO target USING source ON target.id = source.id')
-- !query schema
struct<parse_sql(MERGE INTO target USING source ON target.id = source.id):string>
-- !query output
{"parse_success":false,"error":{"errorClass":"MERGE_WITHOUT_WHEN","messageTemplate":"There must be at least one WHEN clause in a MERGE statement.","sqlState":"42601","queryContext":[{"objectType":"","objectName":"","startIndex":1,"stopIndex":55,"fragment":"MERGE INTO target USING source ON target.id = source.id"}],"line":1,"position":0}}


-- !query
SELECT parse_sql('EXPLAIN SELECT 1')
-- !query schema
struct<parse_sql(EXPLAIN SELECT 1):string>
-- !query output
{"parse_success":true,"statement_identifier":"EXPLAIN","statement_code":-23,"select_list":[{"name":[]}]}


-- !query
SELECT parse_sql('SET spark.sql.adaptive.enabled=true')
-- !query schema
struct<parse_sql(SET spark.sql.adaptive.enabled=true):string>
-- !query output
{"parse_success":true,"statement_identifier":"SET","statement_code":-24}


-- !query
SELECT parse_sql('ADD JAR /tmp/x.jar')
-- !query schema
struct<parse_sql(ADD JAR /tmp/x.jar):string>
-- !query output
{"parse_success":true,"statement_identifier":"ADD JAR","statement_code":-26}


-- !query
SELECT parse_sql('CREATE VIEW v AS SELECT a, b FROM t')
-- !query schema
struct<parse_sql(CREATE VIEW v AS SELECT a, b FROM t):string>
-- !query output
{"parse_success":true,"statement_identifier":"CREATE VIEW","statement_code":84,"target_table_references":[["v"]],"source_table_references":[["t"]],"select_list":[{"name":["a"]},{"name":["b"]}]}


-- !query
SELECT parse_sql('SELECT 1 AS IDENTIFIER(''alias.field'')')
-- !query schema
struct<parse_sql(SELECT 1 AS IDENTIFIER('alias.field')):string>
-- !query output
{"parse_success":false,"error":{"errorClass":"IDENTIFIER_TOO_MANY_NAME_PARTS","messageTemplate":"<identifier> is not a valid identifier as it has more than <limit> name parts.","sqlState":"42601","messageParameters":{"identifier":"`alias`.`field`","limit":"1"},"queryContext":[{"objectType":"","objectName":"","startIndex":8,"stopIndex":37,"fragment":"1 AS IDENTIFIER('alias.field')"}],"line":1,"position":12}}


-- !query
SELECT parse_sql('SELECT DATE ''not-a-date''')
-- !query schema
struct<parse_sql(SELECT DATE 'not-a-date'):string>
-- !query output
{"parse_success":false,"error":{"errorClass":"INVALID_TYPED_LITERAL","messageTemplate":"The value of the typed literal <valueType> is invalid: <value>.","sqlState":"42604","messageParameters":{"value":"'not-a-date'","valueType":"\"DATE\""},"queryContext":[{"objectType":"","objectName":"","startIndex":8,"stopIndex":24,"fragment":"DATE 'not-a-date'"}],"line":1,"position":7}}


-- !query
SELECT parse_sql(
'BEGIN
   SELECT 1;
   SELEC 2;
 END')
-- !query schema
struct<parse_sql(BEGIN
   SELECT 1;
   SELEC 2;
 END):string>
-- !query output
{"parse_success":false,"error":{"errorClass":"PARSE_SYNTAX_ERROR","messageTemplate":"Syntax error at or near <error><hint>.","sqlState":"42601","messageParameters":{"error":"'2'","hint":""},"queryContext":[{"objectType":"","objectName":"","startIndex":1,"stopIndex":35,"fragment":"BEGIN\n   SELECT 1;\n   SELEC 2;\n END"}],"line":3,"position":9}}


-- !query
SELECT
  get_json_object(result, '$.error.errorClass') AS error_class,
  get_json_object(result, '$.error.line') AS line,
  get_json_object(result, '$.error.position') AS position,
  get_json_object(result, '$.error.queryContext[0].fragment') AS fragment
FROM (
  SELECT parse_sql(
'BEGIN
   SELECT 1;
   SELEC 2;
 END') AS result
)
-- !query schema
struct<error_class:string,line:string,position:string,fragment:string>
-- !query output
PARSE_SYNTAX_ERROR	3	9	BEGIN
   SELECT 1;
   SELEC 2;
 END


-- !query
SELECT parse_sql(
'BEGIN
   lbl_begin: BEGIN
     SELECT 1;
   END lbl_end;
 END')
-- !query schema
struct<parse_sql(BEGIN
   lbl_begin: BEGIN
     SELECT 1;
   END lbl_end;
 END):string>
-- !query output
{"parse_success":false,"error":{"errorClass":"LABELS_MISMATCH","messageTemplate":"Begin label <beginLabel> does not match the end label <endLabel>.","sqlState":"42K0L","messageParameters":{"beginLabel":"`lbl_begin`","endLabel":"`lbl_end`"},"queryContext":[{"objectType":"","objectName":"","startIndex":10,"stopIndex":19,"fragment":"lbl_begin:"}],"line":2,"position":3}}


-- !query
SELECT
  get_json_object(result, '$.error.errorClass') AS error_class,
  get_json_object(result, '$.error.line') AS line,
  get_json_object(result, '$.error.position') AS position,
  get_json_object(result, '$.error.queryContext[0].fragment') AS fragment
FROM (
  SELECT parse_sql(
'BEGIN
   lbl_begin: BEGIN
     SELECT 1;
   END lbl_end;
 END') AS result
)
-- !query schema
struct<error_class:string,line:string,position:string,fragment:string>
-- !query output
LABELS_MISMATCH	2	3	lbl_begin:


-- !query
SELECT sql_text, parse_sql(sql_text) FROM VALUES
  ('SELECT 1'),
  ('INSERT INTO t SELECT 1'),
  ('CACHE TABLE t')
AS t(sql_text)
-- !query schema
struct<sql_text:string,parse_sql(sql_text):string>
-- !query output
CACHE TABLE t	{"parse_success":true,"statement_identifier":"CACHE TABLE","statement_code":-1,"target_table_references":[["t"]]}
INSERT INTO t SELECT 1	{"parse_success":true,"statement_identifier":"INSERT","statement_code":50,"target_table_references":[["t"]],"select_list":[{"name":[]}]}
SELECT 1	{"parse_success":true,"statement_identifier":"SELECT","statement_code":21,"select_list":[{"name":[]}]}


-- !query
SELECT parse_sql('BEGIN SELECT 1; END')
-- !query schema
struct<parse_sql(BEGIN SELECT 1; END):string>
-- !query output
{"parse_success":true,"statement_identifier":"BEGIN END","statement_code":-22}


-- !query
SELECT parse_sql('BEGIN SELECT count(a) FROM script_t WHERE c = :p; END')
-- !query schema
struct<parse_sql(BEGIN SELECT count(a) FROM script_t WHERE c = :p; END):string>
-- !query output
{"parse_success":true,"statement_identifier":"BEGIN END","statement_code":-22,"source_table_references":[["script_t"]],"function_references":[["count"]],"parameter_markers":{"named":["p"]}}


-- !query
SELECT parse_sql('BEGIN SELECT * FROM t WHERE a = ?; END')
-- !query schema
struct<parse_sql(BEGIN SELECT * FROM t WHERE a = ?; END):string>
-- !query output
{"parse_success":true,"statement_identifier":"BEGIN END","statement_code":-22,"source_table_references":[["t"]],"parameter_markers":{"unnamed_count":1}}


-- !query
SELECT parse_sql('BEGIN IF (SELECT flag FROM gate) THEN INSERT INTO dest SELECT * FROM src_if; ELSE DELETE FROM src_else; END IF; END')
-- !query schema
struct<parse_sql(BEGIN IF (SELECT flag FROM gate) THEN INSERT INTO dest SELECT * FROM src_if; ELSE DELETE FROM src_else; END IF; END):string>
-- !query output
{"parse_success":true,"statement_identifier":"BEGIN END","statement_code":-22,"target_table_references":[["dest"],["src_else"]],"source_table_references":[["gate"],["src_if"]]}


-- !query
SELECT parse_sql('BEGIN DECLARE EXIT HANDLER FOR SQLEXCEPTION BEGIN INSERT INTO err_log SELECT * FROM failing_row; END; SELECT a FROM main_t; END')
-- !query schema
struct<parse_sql(BEGIN DECLARE EXIT HANDLER FOR SQLEXCEPTION BEGIN INSERT INTO err_log SELECT * FROM failing_row; END; SELECT a FROM main_t; END):string>
-- !query output
{"parse_success":true,"statement_identifier":"BEGIN END","statement_code":-22,"target_table_references":[["err_log"]],"source_table_references":[["failing_row"],["main_t"]]}


-- !query
SELECT parse_sql(
'BEGIN
   DECLARE EXIT HANDLER FOR SQLEXCEPTION
   BEGIN
     INSERT INTO error_log
     SELECT format_string(''%s'', message) FROM error_source;
   END;

   WITH prepared AS (
     SELECT id, normalize_name(name) AS name
     FROM input_names
     WHERE is_valid(id)
   )
   INSERT INTO output_names
   SELECT id, upper(name) FROM prepared;

   IF EXISTS (SELECT 1 FROM control_flags WHERE enabled()) THEN
     UPDATE update_target
     SET value = coalesce((SELECT max(value) FROM update_source), 0)
     WHERE should_update(id);
   ELSE
     DELETE FROM delete_target
     WHERE id IN (SELECT id FROM delete_source WHERE expired(ts));
   END IF;

   FOR row AS
     SELECT id FROM loop_source WHERE ready(id)
   DO
     SELECT audit(row.id), count(*) FROM loop_body;
   END FOR;
 END')
-- !query schema
struct<parse_sql(BEGIN
   DECLARE EXIT HANDLER FOR SQLEXCEPTION
   BEGIN
     INSERT INTO error_log
     SELECT format_string('%s', message) FROM error_source;
   END;

   WITH prepared AS (
     SELECT id, normalize_name(name) AS name
     FROM input_names
     WHERE is_valid(id)
   )
   INSERT INTO output_names
   SELECT id, upper(name) FROM prepared;

   IF EXISTS (SELECT 1 FROM control_flags WHERE enabled()) THEN
     UPDATE update_target
     SET value = coalesce((SELECT max(value) FROM update_source), 0)
     WHERE should_update(id);
   ELSE
     DELETE FROM delete_target
     WHERE id IN (SELECT id FROM delete_source WHERE expired(ts));
   END IF;

   FOR row AS
     SELECT id FROM loop_source WHERE ready(id)
   DO
     SELECT audit(row.id), count(*) FROM loop_body;
   END FOR;
 END):string>
-- !query output
{"parse_success":true,"statement_identifier":"BEGIN END","statement_code":-22,"target_table_references":[["error_log"],["output_names"],["update_target"],["delete_target"]],"source_table_references":[["error_source"],["input_names"],["control_flags"],["update_source"],["delete_source"],["loop_source"],["loop_body"]],"function_references":[["format_string"],["normalize_name"],["is_valid"],["upper"],["enabled"],["coalesce"],["should_update"],["max"],["expired"],["ready"],["audit"],["count"]]}
